{
  "adapter_id": "local.mock-adapter",
  "name": "Local Mock Adapter",
  "adapter_version": "0.1.0",
  "protocol_versions": ["0.1.0"],
  "harness_type": "mock",
  "entrypoint": {
    "executable": "mock-adapter",
    "args": ["--stdio"]
  },
  "platforms": ["macos-aarch64", "linux-x86_64"],
  "capabilities": ["health.check", "run.start", "run.status", "run.cancel", "run.reconcile", "run.output.streaming"],
  "auth_modes": ["none"],
  "configuration_schema": null,
  "extensions": {}
}
